{
  "schema_version": "g12a.v1",
  "tool": "tools/uni_cluster_review_g12_a.py",
  "input": {
    "path": "docs/coordination/UNI_REDUNDANCY_PRIORITY_G11_A.json",
    "schema_version": "g11a.v1",
    "component_count": 85,
    "component_ids_sha256": "b5467541d289c3773aca6ab982e7604459203be2f54ed93ecd9601f7ce47d234",
    "report_sha256": "eb4342042a45dd2645012fed073b43535ed254bd746a55380df6200ac40101e6"
  },
  "scope": {
    "decision_level": "connected_component",
    "initial_decision": null,
    "allowed_decisions": [
      "distinct",
      "merge_candidate",
      "reject_candidate",
      "needs_source_review"
    ],
    "human_review_required": true,
    "answers_read": false,
    "didactic_content_copied": false,
    "didactic_content_modified": false,
    "automatic_card_modification": false,
    "automatic_exam_modification": false,
    "automatic_merge_or_reject": false,
    "files_deleted": false,
    "source_of_truth": "G11 priority queue component metadata"
  },
  "review_policy": {
    "evidence_ref_required_for_non_null_decision": true,
    "reviewer_required": true,
    "rationale_required": true,
    "null_initial_state_is_pending": true,
    "decision_is_not_an_action": true
  },
  "coverage": {
    "component_count": 85,
    "pending_count": 85,
    "decided_count": 0,
    "all_decisions_null": true
  },
  "review_queue": [
    {
      "component_id": "component-0036",
      "priority_rank": 1,
      "priority_key": {
        "collision_count": 78,
        "coverage_count": 1,
        "pack_count": 0,
        "exam_count": 1,
        "node_count": 13,
        "source_group": "public_exams",
        "component_id": "component-0036"
      },
      "source_group": "public_exams",
      "unit_ids": [
        "exam:UNIVERSITA_EDILIZIA/ESAMI/IMPIANTI_FV_EOLICO/domande.md#question-0174",
        "exam:UNIVERSITA_EDILIZIA/ESAMI/IMPIANTI_FV_EOLICO/domande.md#question-0202",
        "exam:UNIVERSITA_EDILIZIA/ESAMI/IMPIANTI_FV_EOLICO/domande.md#question-0335",
        "exam:UNIVERSITA_EDILIZIA/ESAMI/IMPIANTI_FV_EOLICO/domande.md#question-0339",
        "exam:UNIVERSITA_EDILIZIA/ESAMI/IMPIANTI_FV_EOLICO/domande.md#question-0549",
        "exam:UNIVERSITA_EDILIZIA/ESAMI/IMPIANTI_FV_EOLICO/domande.md#question-0557",
        "exam:UNIVERSITA_EDILIZIA/ESAMI/IMPIANTI_FV_EOLICO/domande.md#question-0633",
        "exam:UNIVERSITA_EDILIZIA/ESAMI/IMPIANTI_FV_EOLICO/domande.md#question-0695",
        "exam:UNIVERSITA_EDILIZIA/ESAMI/IMPIANTI_FV_EOLICO/domande.md#question-0719",
        "exam:UNIVERSITA_EDILIZIA/ESAMI/IMPIANTI_FV_EOLICO/domande.md#question-0826",
        "exam:UNIVERSITA_EDILIZIA/ESAMI/IMPIANTI_FV_EOLICO/domande.md#question-0871",
        "exam:UNIVERSITA_EDILIZIA/ESAMI/IMPIANTI_FV_EOLICO/domande.md#question-0917",
        "exam:UNIVERSITA_EDILIZIA/ESAMI/IMPIANTI_FV_EOLICO/domande.md#question-0921"
      ],
      "coverage": {
        "source_paths": [
          "UNIVERSITA_EDILIZIA/ESAMI/IMPIANTI_FV_EOLICO/domande.md"
        ],
        "pack_paths": [],
        "exam_paths": [
          "UNIVERSITA_EDILIZIA/ESAMI/IMPIANTI_FV_EOLICO/domande.md"
        ],
        "source_file_count": 1,
        "pack_count": 0,
        "exam_count": 1,
        "coverage_count": 1
      },
      "collision_count": 78,
      "review": {
        "decision": null,
        "evidence_ref": null,
        "reviewer": null,
        "rationale": null
      }
    },
    {
      "component_id": "component-0025",
      "priority_rank": 2,
      "priority_key": {
        "collision_count": 10,
        "coverage_count": 1,
        "pack_count": 0,
        "exam_count": 1,
        "node_count": 5,
        "source_group": "public_exams",
        "component_id": "component-0025"
      },
      "source_group": "public_exams",
      "unit_ids": [
        "exam:UNIVERSITA_EDILIZIA/ESAMI/IMPIANTI_FV_EOLICO/domande.md#question-0083",
        "exam:UNIVERSITA_EDILIZIA/ESAMI/IMPIANTI_FV_EOLICO/domande.md#question-0201",
        "exam:UNIVERSITA_EDILIZIA/ESAMI/IMPIANTI_FV_EOLICO/domande.md#question-0720",
        "exam:UNIVERSITA_EDILIZIA/ESAMI/IMPIANTI_FV_EOLICO/domande.md#question-0966",
        "exam:UNIVERSITA_EDILIZIA/ESAMI/IMPIANTI_FV_EOLICO/domande.md#question-0976"
      ],
      "coverage": {
        "source_paths": [
          "UNIVERSITA_EDILIZIA/ESAMI/IMPIANTI_FV_EOLICO/domande.md"
        ],
        "pack_paths": [],
        "exam_paths": [
          "UNIVERSITA_EDILIZIA/ESAMI/IMPIANTI_FV_EOLICO/domande.md"
        ],
        "source_file_count": 1,
        "pack_count": 0,
        "exam_count": 1,
        "coverage_count": 1
      },
      "collision_count": 10,
      "review": {
        "decision": null,
        "evidence_ref": null,
        "reviewer": null,
        "rationale": null
      }
    },
    {
      "component_id": "component-0033",
      "priority_rank": 3,
      "priority_key": {
        "collision_count": 10,
        "coverage_count": 1,
        "pack_count": 0,
        "exam_count": 1,
        "node_count": 5,
        "source_group": "public_exams",
        "component_id": "component-0033"
      },
      "source_group": "public_exams",
      "unit_ids": [
        "exam:UNIVERSITA_EDILIZIA/ESAMI/IMPIANTI_FV_EOLICO/domande.md#question-0142",
        "exam:UNIVERSITA_EDILIZIA/ESAMI/IMPIANTI_FV_EOLICO/domande.md#question-0468",
        "exam:UNIVERSITA_EDILIZIA/ESAMI/IMPIANTI_FV_EOLICO/domande.md#question-0681",
        "exam:UNIVERSITA_EDILIZIA/ESAMI/IMPIANTI_FV_EOLICO/domande.md#question-0828",
        "exam:UNIVERSITA_EDILIZIA/ESAMI/IMPIANTI_FV_EOLICO/domande.md#question-0977"
      ],
      "coverage": {
        "source_paths": [
          "UNIVERSITA_EDILIZIA/ESAMI/IMPIANTI_FV_EOLICO/domande.md"
        ],
        "pack_paths": [],
        "exam_paths": [
          "UNIVERSITA_EDILIZIA/ESAMI/IMPIANTI_FV_EOLICO/domande.md"
        ],
        "source_file_count": 1,
        "pack_count": 0,
        "exam_count": 1,
        "coverage_count": 1
      },
      "collision_count": 10,
      "review": {
        "decision": null,
        "evidence_ref": null,
        "reviewer": null,
        "rationale": null
      }
    },
    {
      "component_id": "component-0001",
      "priority_rank": 4,
      "priority_key": {
        "collision_count": 6,
        "coverage_count": 1,
        "pack_count": 0,
        "exam_count": 1,
        "node_count": 4,
        "source_group": "public_exams",
        "component_id": "component-0001"
      },
      "source_group": "public_exams",
      "unit_ids": [
        "exam:UNIVERSITA_EDILIZIA/ESAMI/CAPPOTTO/domande.md#question-0026",
        "exam:UNIVERSITA_EDILIZIA/ESAMI/CAPPOTTO/domande.md#question-0029",
        "exam:UNIVERSITA_EDILIZIA/ESAMI/CAPPOTTO/domande.md#question-0074",
        "exam:UNIVERSITA_EDILIZIA/ESAMI/CAPPOTTO/domande.md#question-0085"
      ],
      "coverage": {
        "source_paths": [
          "UNIVERSITA_EDILIZIA/ESAMI/CAPPOTTO/domande.md"
        ],
        "pack_paths": [],
        "exam_paths": [
          "UNIVERSITA_EDILIZIA/ESAMI/CAPPOTTO/domande.md"
        ],
        "source_file_count": 1,
        "pack_count": 0,
        "exam_count": 1,
        "coverage_count": 1
      },
      "collision_count": 6,
      "review": {
        "decision": null,
        "evidence_ref": null,
        "reviewer": null,
        "rationale": null
      }
    },
    {
      "component_id": "component-0002",
      "priority_rank": 5,
      "priority_key": {
        "collision_count": 6,
        "coverage_count": 1,
        "pack_count": 0,
        "exam_count": 1,
        "node_count": 4,
        "source_group": "public_exams",
        "component_id": "component-0002"
      },
      "source_group": "public_exams",
      "unit_ids": [
        "exam:UNIVERSITA_EDILIZIA/ESAMI/DESIGN_GUSTO/domande.md#question-0008",
        "exam:UNIVERSITA_EDILIZIA/ESAMI/DESIGN_GUSTO/domande.md#question-0063",
        "exam:UNIVERSITA_EDILIZIA/ESAMI/DESIGN_GUSTO/domande.md#question-0096",
        "exam:UNIVERSITA_EDILIZIA/ESAMI/DESIGN_GUSTO/domande.md#question-0111"
      ],
      "coverage": {
        "source_paths": [
          "UNIVERSITA_EDILIZIA/ESAMI/DESIGN_GUSTO/domande.md"
        ],
        "pack_paths": [],
        "exam_paths": [
          "UNIVERSITA_EDILIZIA/ESAMI/DESIGN_GUSTO/domande.md"
        ],
        "source_file_count": 1,
        "pack_count": 0,
        "exam_count": 1,
        "coverage_count": 1
      },
      "collision_count": 6,
      "review": {
        "decision": null,
        "evidence_ref": null,
        "reviewer": null,
        "rationale": null
      }
    },
    {
      "component_id": "component-0004",
      "priority_rank": 6,
      "priority_key": {
        "collision_count": 6,
        "coverage_count": 1,
        "pack_count": 0,
        "exam_count": 1,
        "node_count": 4,
        "source_group": "public_exams",
        "component_id": "component-0004"
      },
      "source_group": "public_exams",
      "unit_ids": [
        "exam:UNIVERSITA_EDILIZIA/ESAMI/ENERGETICA_INCENTIVI/domande.md#question-0054",
        "exam:UNIVERSITA_EDILIZIA/ESAMI/ENERGETICA_INCENTIVI/domande.md#question-0089",
        "exam:UNIVERSITA_EDILIZIA/ESAMI/ENERGETICA_INCENTIVI/domande.md#question-0130",
        "exam:UNIVERSITA_EDILIZIA/ESAMI/ENERGETICA_INCENTIVI/domande.md#question-0155"
      ],
      "coverage": {
        "source_paths": [
          "UNIVERSITA_EDILIZIA/ESAMI/ENERGETICA_INCENTIVI/domande.md"
        ],
        "pack_paths": [],
        "exam_paths": [
          "UNIVERSITA_EDILIZIA/ESAMI/ENERGETICA_INCENTIVI/domande.md"
        ],
        "source_file_count": 1,
        "pack_count": 0,
        "exam_count": 1,
        "coverage_count": 1
      },
      "collision_count": 6,
      "review": {
        "decision": null,
        "evidence_ref": null,
        "reviewer": null,
        "rationale": null
      }
    },
    {
      "component_id": "component-0007",
      "priority_rank": 7,
      "priority_key": {
        "collision_count": 6,